<?xml version="1.0" encoding="UTF-8" ?>
<gems xmlns:xsi="http://www.w3.org/2001/XMLSchema-instance"
      xmlns="http://training.by/gems"
      xsi:schemaLocation="http://training.by/gems ../gems.xsd">
    <gem id="x1">
        <name>Diamond</name>
        <preciousness>precious</preciousness>
        <origin>Australia</origin>
        <visual-parameters>
            <color>white</color>
            <transparency value="40"/>
            <facets-number value="10"/>
        </visual-parameters>
        <value>5</value>
        <date>2021-10-08</date>
    </gem>

    <synthetic-gem id="x16">
        <name>Emerald</name>
        <preciousness>precious</preciousness>
        <origin>Switzerland</origin>
        <visual-parameters>
            <color>green</color>
            <transparency/>
            <facets-number value="6"/>
        </visual-parameters>
        <value>5</value>
        <date>2021-10-13</date>
        <laboratory>SSEF Lab</laboratory>
    </synthetic-gem>
</gems>
