<?xml version="1.0" encoding="UTF-8" ?>
<gems xmlns:xsi="http://www.w3.org/2001/XMLSchema-instance"
      xmlns="http://training.by/gems"
      xsi:schemaLocation="http://training.by/gems ../gems.xsd">
    <gem id="x5">
        <name>Heliodor</name>
        <preciousness>semiprecious</preciousness>
        <origin>Russia</origin>
        <visual-parameters>
            <color>yellow</color>
            <transparency value="5"/>
            <facets-number value="8"/>
        </visual-parameters>
        <value>7</value>
        <date>2021-10-09</date>
    </gem>

    <gem id="x6">
        <name>Sapphire</name>
        <preciousness>precious</preciousness>
        <origin>USA</origin>
        <visual-parameters>
            <color>blue</color>
            <transparency value="30"/>
            <facets-number value="12"/>
        </visual-parameters>
        <value>11</value>
        <date>2021-10-09</date>
    </gem>

    <gem id="x7">
        <name>Alexandrite</name>
        <preciousness>precious</preciousness>
        <origin>South Africa</origin>
        <visual-parameters>
            <color>green</color>
            <transparency value="7"/>
            <facets-number value="15"/>
        </visual-parameters>
        <value>15</value>
        <date>2021-10-10</date>
    </gem>

    <synthetic-gem id="x8">
        <name>Diamond</name>
        <preciousness>precious</preciousness>
        <origin>Britain</origin>
        <visual-parameters>
            <color>white</color>
            <transparency/>
            <facets-number value="11"/>
        </visual-parameters>
        <value>13</value>
        <date>2021-10-04</date>
        <laboratory>De Beers</laboratory>
    </synthetic-gem>

    <synthetic-gem id="x9">
        <name>Emerald</name>
        <preciousness>precious</preciousness>
        <origin>Russia</origin>
        <visual-parameters>
            <color>green</color>
            <transparency/>
            <facets-number value="14"/>
        </visual-parameters>
        <value>16</value>
        <date>2021-10-06</date>
        <laboratory>Alrosa</laboratory>
    </synthetic-gem>

    <gem id="x10">
        <name>Garnet</name>
        <preciousness>semiprecious</preciousness>
        <origin>Russia</origin>
        <visual-parameters>
            <color>red</color>
            <transparency value="30"/>
            <facets-number value="4"/>
        </visual-parameters>
        <value>5</value>
        <date>2021-09-30</date>
    </gem>

    <gem id="x11">
        <name>Demantoid</name>
        <preciousness>semiprecious</preciousness>
        <origin>Italy</origin>
        <visual-parameters>
            <color>green</color>
            <transparency/>
            <facets-number value="15"/>
        </visual-parameters>
        <value>7</value>
        <date>2021-09-27</date>
    </gem>

    <gem id="x12">
        <name>Eremeevit</name>
        <preciousness>semiprecious</preciousness>
        <origin>France</origin>
        <visual-parameters>
            <color>blue</color>
            <transparency value="90"/>
            <facets-number value="5"/>
        </visual-parameters>
        <value>2</value>
        <date>2021-10-11</date>
    </gem>

    <synthetic-gem id="x13">
        <name>Cordierite</name>
        <preciousness>semiprecious</preciousness>
        <origin>USA</origin>
        <visual-parameters>
            <color>blue</color>
            <transparency/>
            <facets-number value="4"/>
        </visual-parameters>
        <value>7</value>
        <date>2021-10-11</date>
        <laboratory>GIA Gem Lab</laboratory>
    </synthetic-gem>

    <synthetic-gem id="x14">
        <name>Rhodochrosite</name>
        <preciousness>semiprecious</preciousness>
        <origin>Germany</origin>
        <visual-parameters>
            <color>red</color>
            <transparency value="30"/>
            <facets-number value="5"/>
        </visual-parameters>
        <value>1</value>
        <date>2021-10-07</date>
        <laboratory>Gubelin Gem Lab</laboratory>
    </synthetic-gem>

    <gem id="x15">
        <name>Diamond</name>
        <preciousness>precious</preciousness>
        <origin>Botswana</origin>
        <visual-parameters>
            <color>white</color>
            <transparency value="90"/>
            <facets-number value="8"/>
        </visual-parameters>
        <value>2</value>
        <date>2021-10-09</date>
    </gem>

    <synthetic-gem id="x16">
        <name>Emerald</name>
        <preciousness>precious</preciousness>
        <origin>Switzerland</origin>
        <visual-parameters>
            <color>green</color>
            <transparency/>
            <facets-number value="6"/>
        </visual-parameters>
        <value>5</value>
        <date>2021-10-13</date>
        <laboratory>SSEF Lab</laboratory>
    </synthetic-gem>
</gems>
